Rank,NCT Number,Title,Conditions,Interventions,Title_condition_intervention,Types
3,NCT02166255,APN401 in Treating Patients With Melanoma Kidney Cancer Pancreatic Cancer or Other Solid Tumors That Are Metastatic or Cannot Be Removed By Surgery,Recurrent Melanoma|Recurrent Pancreatic Cancer|Recurrent Renal Cell Cancer|Stage III Pancreatic Cancer|Stage III Renal Cell Cancer|Stage IIIA Melanoma|Stage IIIB Melanoma|Stage IIIC Melanoma|Stage IV Melanoma|Stage IV Pancreatic Cancer|Stage IV Renal Cell Cancer|Unspecified Adult Solid Tumor Protocol Specific,Biological: siRNA-transfected peripheral blood mononuclear cells APN401|Other: laboratory biomarker analysis,APN401 in Treating Patients With Melanoma Kidney Cancer Pancreatic Cancer or Other Solid Tumors That Are Metastatic or Cannot Be Removed By Surgery Recurrent Melanoma|Recurrent Pancreatic Cancer|Recurrent Renal Cell Cancer|Stage III Pancreatic Cancer|Stage III Renal Cell Cancer|Stage IIIA Melanoma|Stage IIIB Melanoma|Stage IIIC Melanoma|Stage IV Melanoma|Stage IV Pancreatic Cancer|Stage IV Renal Cell Cancer|Unspecified Adult Solid Tumor Protocol Specific Biological: siRNA-transfected peripheral blood mononuclear cells APN401|Other: laboratory biomarker analysis,Other
3,NCT02154867,Fecal Microbial Transplantation in Treatment of Irritable Bowel Syndrome; a Double Blinded Placebo Controlled Trial.,Irritable Bowel Syndrome,Biological: Fecal transplantation|Other: Placebo fecal transplant,Fecal Microbial Transplantation in Treatment of Irritable Bowel Syndrome; a Double Blinded Placebo Controlled Trial. Irritable Bowel Syndrome Biological: Fecal transplantation|Other: Placebo fecal transplant,Other
3,NCT02140112,Efficacy and Safety of Trichuris Suis Ova (TSO) as Compared to Placebo in Autism Spectrum Disorder,Autism,Biological: Trichuris suis ova|Other: Placebo,Efficacy and Safety of Trichuris Suis Ova (TSO) as Compared to Placebo in Autism Spectrum Disorder Autism Biological: Trichuris suis ova|Other: Placebo,Other
3,NCT02130310,Evaluation of CureXcell¶© in Treating Chronic Venous Leg Ulcers,Chronic Venous Leg Ulcers,Biological: CureXcell¶©|Other: Placebo injection,Evaluation of CureXcell¶© in Treating Chronic Venous Leg Ulcers Chronic Venous Leg Ulcers Biological: CureXcell¶©|Other: Placebo injection,Other
3,NCT02094885,The Bioseal Vascular Study,Cardiovascular Bleeding|Vascular Bleeding|Hemorrhage,Biological: Bioseal Fibrin Sealant|Other: Manual Compression,The Bioseal Vascular Study Cardiovascular Bleeding|Vascular Bleeding|Hemorrhage Biological: Bioseal Fibrin Sealant|Other: Manual Compression,Other
3,NCT03804112,TransIent Perivascular Inflammation of the Carotid Artery (TIPIC) Syndrome: Clinical and Radiological Follow-up,Cervical Pain|Vasculitis,Diagnostic Test: Ultrasound exam with Doppler|Biological: Blood samples,TransIent Perivascular Inflammation of the Carotid Artery (TIPIC) Syndrome: Clinical and Radiological Follow-up Cervical Pain|Vasculitis Diagnostic Test: Ultrasound exam with Doppler|Biological: Blood samples,Other
3,NCT02087904,A Study Evaluating the Safety Efficacy and Pharmacodynamic Effects of ABT-981 in Patients With Knee Osteoarthritis,Knee Osteoarthritis|Medial Compartment Knee Osteoarthritis,Biological: ABT-981|Other: Placebo,A Study Evaluating the Safety Efficacy and Pharmacodynamic Effects of ABT-981 in Patients With Knee Osteoarthritis Knee Osteoarthritis|Medial Compartment Knee Osteoarthritis Biological: ABT-981|Other: Placebo,Other
3,NCT02057211,Mesenchymal Stem Cells to Intervene in the Development of Type 1 Diabetes: a Blinded Randomized Study,Type 1 Diabetes Mellitus,Biological: autologous mesenchymal stem cell transplantation|Procedure: sham transplantation of mesenchymal stem cells,Mesenchymal Stem Cells to Intervene in the Development of Type 1 Diabetes: a Blinded Randomized Study Type 1 Diabetes Mellitus Biological: autologous mesenchymal stem cell transplantation|Procedure: sham transplantation of mesenchymal stem cells,Other
3,NCT02054208,Safety and Exploratory Efficacy Study of NEUROSTEM¶© Versus Placebo in Patients With Alzheimer's Disease,Alzheimer's Disease,Biological: human umbilical cord blood derived mesenchymal stem cells|Other: Normal saline 2mL,Safety and Exploratory Efficacy Study of NEUROSTEM¶© Versus Placebo in Patients With Alzheimer's Disease Alzheimer's Disease Biological: human umbilical cord blood derived mesenchymal stem cells|Other: Normal saline 2mL,Other
3,NCT02034799,Phase IV Bioseal Study in Brain Tumor Surgery,Hemostasis|Meningioma Surgery,Biological: Bioseal Fibrin Sealant|Other: Standard of Care (SoC),Phase IV Bioseal Study in Brain Tumor Surgery Hemostasis|Meningioma Surgery Biological: Bioseal Fibrin Sealant|Other: Standard of Care (SoC),Other
3,NCT02005848,Phase II Study to Evaluate the Efficacy and Safety of Glassia¶© in Type-1 Diabetes,New Onset Type-1 Diabetes,Biological: Alpha-1 Antitrypsin|Other: Placebo,Phase II Study to Evaluate the Efficacy and Safety of Glassia¶© in Type-1 Diabetes New Onset Type-1 Diabetes Biological: Alpha-1 Antitrypsin|Other: Placebo,Other
3,NCT01982474,Safety of Lymph Node Injection for Allergen Immunotherapy,Allergic Rhinitis,Biological: Grass pollen extract|Other: Placebo injection,Safety of Lymph Node Injection for Allergen Immunotherapy Allergic Rhinitis Biological: Grass pollen extract|Other: Placebo injection,Other
3,NCT01978561,Follow-Up Of Pregnancies Established During Study NT-03 (Thrive-IVF Follow-Up),Repeated IVF Failure,Biological: Post dosing with NT100|Other: Post dosing with Placebo,Follow-Up Of Pregnancies Established During Study NT-03 (Thrive-IVF Follow-Up) Repeated IVF Failure Biological: Post dosing with NT100|Other: Post dosing with Placebo,Other
3,NCT03633500,Effectiveness of Oral Immunotherapy Among Preterm Babies,Feeding Behavior|Late-Onset Neonatal Sepsis,Other: Sterile water|Biological: Breastmilk,Effectiveness of Oral Immunotherapy Among Preterm Babies Feeding Behavior|Late-Onset Neonatal Sepsis Other: Sterile water|Biological: Breastmilk,Other
3,NCT01950975,Screening for Chromosomal Microarrangements by CGH-array in Developmental Anomalies of the Skin Suggestive of Mosaicism.,Malformations With Skin Manifestations Suggesting Mosaicism,Biological: Peripheral blood samples in EDTA tubes|Procedure: Skin biopsies,Screening for Chromosomal Microarrangements by CGH-array in Developmental Anomalies of the Skin Suggestive of Mosaicism. Malformations With Skin Manifestations Suggesting Mosaicism Biological: Peripheral blood samples in EDTA tubes|Procedure: Skin biopsies,Other
3,NCT03550833,Impact of Life Events and Psychological Stress in Rheumatoid Arthritis Set-up : Case-control Study Within a Multifactorial and Integrative Psychological Model,Arthritis Rheumatoid|Stress Disorder,Behavioral: Questionnaire|Biological: blood sample,Impact of Life Events and Psychological Stress in Rheumatoid Arthritis Set-up : Case-control Study Within a Multifactorial and Integrative Psychological Model Arthritis Rheumatoid|Stress Disorder Behavioral: Questionnaire|Biological: blood sample,Other
3,NCT01896635,Faecal Microbiota Transplantation in Ulcerative Colitis,Ulcerative Colitis|Inflammatory Bowel Disease,Biological: FMT infusions|Other: Placebo infusion,Faecal Microbiota Transplantation in Ulcerative Colitis Ulcerative Colitis|Inflammatory Bowel Disease Biological: FMT infusions|Other: Placebo infusion,Other
3,NCT01873547,Different Efficacy Between Rehabilitation Therapy and Stem Cells Transplantation in Patients With SCI in China,Spinal Cord Injury,Biological: cell therapy|Other: rehabilitation,Different Efficacy Between Rehabilitation Therapy and Stem Cells Transplantation in Patients With SCI in China Spinal Cord Injury Biological: cell therapy|Other: rehabilitation,Other
